{
  "$schema": "./portal-config.schema.json",
  "product": {
    "name": "Open Health Stack"
  },
  "brand": {
    "overrides": {
      "primary": "#094F9A",
      "on-primary": "#FAFAFA",
      "primary-container": "#DCE5FE",
      "secondary-container": "#BCCEFE",
      "surface-container": "#FAFAFA",
      "on-surface": "#0D0D0D",
      "on-surface-variant": "#696969",
      "outline-variant": "#EDEDED",
      "warning-container": "#FFF5CC",
      "error": "#E50000"
    },
    "darkOverrides": {
      "primary-container": "#04366D",
      "secondary-container": "#04366D",
      "surface": "#0D0D0D",
      "surface-container": "#0D0D0D",
      "surface-container-lowest": "#1A1A1A",
      "surface-container-low": "#1A1A1A",
      "on-surface": "#FAFAFA",
      "on-surface-variant": "#9E9E9E",
      "outline-variant": "#363636",
      "error": "#FF8F8F"
    }
  },
  "navigation": [
    {
      "id": "dashboard",
      "to": "/",
      "labelKey": "navDashboard",
      "order": 10,
      "requires": { "flag": "dashboard", "permission": "dashboard.view" }
    },
    {
      "id": "users",
      "to": "/users",
      "labelKey": "navUsers",
      "order": 20,
      "requires": { "flag": "userMgmt", "permission": "users.view" }
    },
    {
      "id": "locations",
      "to": "/locations",
      "labelKey": "navLocations",
      "order": 30,
      "requires": { "flag": "locationMgmt", "permission": "locations.view" }
    },
    {
      "id": "organizations",
      "to": "/organizations",
      "labelKey": "navOrganizations",
      "order": 40,
      "requires": { "flag": "orgMgmt", "permission": "orgs.view" }
    },
    {
      "id": "careTeams",
      "to": "/care-teams",
      "labelKey": "navCareTeams",
      "order": 50,
      "requires": { "flag": "careTeams", "permission": "careteams.view" }
    },
    {
      "id": "fhirViewer",
      "to": "/resources",
      "labelKey": "navFhirViewer",
      "order": 60,
      "requires": { "flag": "fhirViewer", "permission": "fhir-viewer.view" }
    },
    {
      "id": "setup",
      "to": "/setup",
      "labelKey": "navSetup",
      "order": 70,
      "requires": { "flag": "setupWizard", "permission": "setup.view" }
    },
    {
      "id": "audit",
      "to": "/audit",
      "labelKey": "navAudit",
      "order": 80,
      "requires": { "flag": "auditLog", "permission": "audit.view" }
    }
  ],
  "permissionMap": {
    "dashboard.view": ["admin", "care-team-manager"],
    "users.view": ["admin", "care-team-manager"],
    "users.create": ["admin"],
    "users.edit": ["admin"],
    "users.deactivate": ["admin"],
    "locations.view": ["admin", "care-team-manager"],
    "locations.edit": ["admin"],
    "location-hierarchy.view": ["admin", "location-hierarchy.view"],
    "bulk-import.manage": ["admin", "bulk-import.manage"],
    "orgs.view": ["admin", "care-team-manager"],
    "orgs.create": ["admin"],
    "careteams.view": ["admin", "care-team-manager"],
    "careteams.manage": ["admin", "care-team-manager"],
    "setup.view": ["admin"],
    "fhir-viewer.view": ["admin", "care-team-manager"],
    "fhir-viewer.edit": ["admin"],
    "audit.view": ["admin"],
    "configuration.edit": ["admin"]
  },
  "locale": "en",
  "customEndpoints": {
    "users": "/api/users",
    "groups": "/api/groups",
    "roles": "/api/roles",
    "locationHierarchy": "/api/location-hierarchy",
    "locationsBulkImport": "/api/bulk-import/locations",
    "usersBulkImport": "/api/bulk-import/users",
    "organizationsBulkImport": "/api/bulk-import/organizations",
    "practitionerDetails": "/api/practitioner-details",
    "configAssist": "/api/config-assist"
  }
}
